{
  "version": "1.0.0",
  "name": "Educational Animation Framework Design Tokens",
  "description": "Standard cross-renderer visual design tokens for STEM educational animation, conforming to AGENTS.md Rule 7.",
  "colors": {
    "ui": {
      "background": "#020617",
      "surface": "#0f172a",
      "surfaceElevated": "#1e293b",
      "border": "#334155",
      "borderMuted": "#1e293b",
      "textPrimary": "#f8fafc",
      "textMuted": "#94a3b8",
      "accent": "#38bdf8",
      "accentGlow": "#0284c7"
    },
    "reagents": {
      "magnesiumRibbon": "#b0bec5",
      "magnesiumOxide": "#f1f5f9",
      "bunsenFlameInner": "#38bdf8",
      "bunsenFlameOuter": "#facc15",
      "combustionFlash": "#ffffff",
      "heatGlow": "#fb923c",
      "cpkOxygen": "#ef4444",
      "cpkMagnesium": "#8b5cf6",
      "cpkHydrogen": "#f8fafc",
      "cpkCarbon": "#475569",
      "cpkNitrogen": "#3b82f6"
    },
    "optics": {
      "incidentRay": "#ffffff",
      "normalLine": "#94a3b8",
      "refractedRay": "#38bdf8",
      "emergentRay": "#f43f5e",
      "spectrumRed": "#ef4444",
      "spectrumOrange": "#f97316",
      "spectrumYellow": "#eab308",
      "spectrumGreen": "#22c55e",
      "spectrumBlue": "#3b82f6",
      "spectrumIndigo": "#6366f1",
      "spectrumViolet": "#a855f7",
      "copperConductor": "#b45309",
      "wirePositive": "#dc2626",
      "wireNegative": "#2563eb"
    },
    "biology": {
      "oxygenatedBlood": "#dc2626",
      "deoxygenatedBlood": "#2563eb",
      "myocardium": "#991b1b",
      "endocardium": "#fde68a",
      "neuralImpulse": "#facc15",
      "dnaPhosphate": "#0ea5e9",
      "dnaBaseAdenine": "#22c55e",
      "dnaBaseThymine": "#ef4444",
      "dnaBaseGuanine": "#f59e0b",
      "dnaBaseCytosine": "#3b82f6"
    },
    "pedagogy": {
      "trustBadge": "#10b981",
      "misconceptionAlert": "#f97316",
      "safetyWarning": "#ef4444",
      "observationInfo": "#38bdf8",
      "formulaAccent": "#a855f7"
    }
  },
  "typography": {
    "fontFamilies": {
      "sans": "Inter, system-ui, -apple-system, sans-serif",
      "mono": "'JetBrains Mono', 'Fira Code', monospace",
      "math": "'KaTeX_Math', 'Times New Roman', serif"
    },
    "fontSizes": {
      "badge": "11px",
      "caption": "13px",
      "body": "15px",
      "h3": "18px",
      "h2": "22px",
      "h1": "28px",
      "display": "36px",
      "hero": "48px"
    },
    "fontWeights": {
      "regular": 400,
      "medium": 500,
      "semibold": 600,
      "bold": 700,
      "extrabold": 800
    },
    "lineHeights": {
      "tight": 1.15,
      "snug": 1.3,
      "normal": 1.5,
      "relaxed": 1.75
    }
  },
  "materials": {
    "glass_borosilicate": {
      "baseColor": "#e8f4f8",
      "metallic": 0.0,
      "roughness": 0.01,
      "transmission": 0.98,
      "ior": 1.52,
      "clearcoat": 0.2,
      "clearcoatRoughness": 0.1,
      "subsurfaceWeight": 0.0,
      "subsurfaceRadius": [1.0, 1.0, 1.0],
      "subsurfaceScale": 0.01
    },
    "prism_optical_glass": {
      "baseColor": "#f1f5f9",
      "metallic": 0.0,
      "roughness": 0.01,
      "transmission": 0.98,
      "ior": 1.52,
      "clearcoat": 0.2,
      "clearcoatRoughness": 0.1,
      "subsurfaceWeight": 0.0,
      "subsurfaceRadius": [1.0, 1.0, 1.0],
      "subsurfaceScale": 0.01
    },
    "metal_machined_steel": {
      "baseColor": "#9ca3af",
      "metallic": 1.0,
      "roughness": 0.3,
      "transmission": 0.0,
      "ior": 1.5,
      "clearcoat": 0.1,
      "clearcoatRoughness": 0.2,
      "subsurfaceWeight": 0.0,
      "subsurfaceRadius": [1.0, 1.0, 1.0],
      "subsurfaceScale": 0.01
    },
    "metal_magnesium_ribbon": {
      "baseColor": "#b0bec5",
      "metallic": 1.0,
      "roughness": 0.35,
      "transmission": 0.0,
      "ior": 1.5,
      "clearcoat": 0.05,
      "clearcoatRoughness": 0.3,
      "subsurfaceWeight": 0.0,
      "subsurfaceRadius": [1.0, 1.0, 1.0],
      "subsurfaceScale": 0.01
    },
    "metal_magnesium": {
      "baseColor": "#d1c4c9",
      "metallic": 1.0,
      "roughness": 0.5,
      "transmission": 0.0,
      "ior": 1.5,
      "clearcoat": 0.05,
      "clearcoatRoughness": 0.3,
      "subsurfaceWeight": 0.0,
      "subsurfaceRadius": [1.0, 1.0, 1.0],
      "subsurfaceScale": 0.01
    },
    "magnesium_ribbon": {
      "baseColor": "#b0bec5",
      "metallic": 0.0,
      "roughness": 0.35,
      "transmission": 0.0,
      "ior": 1.5,
      "clearcoat": 0.0,
      "clearcoatRoughness": 0.1,
      "subsurfaceWeight": 0.0,
      "subsurfaceRadius": [1.0, 1.0, 1.0],
      "subsurfaceScale": 0.01
    },
    "powder_magnesium_oxide": {
      "baseColor": "#f1f5f9",
      "metallic": 0.0,
      "roughness": 0.95,
      "transmission": 0.0,
      "ior": 1.5,
      "clearcoat": 0.0,
      "clearcoatRoughness": 0.1,
      "subsurfaceWeight": 0.15,
      "subsurfaceRadius": [1.0, 0.2, 0.1],
      "subsurfaceScale": 0.02
    },
    "plastic_labware": {
      "baseColor": "#f8fafc",
      "metallic": 0.0,
      "roughness": 0.4,
      "transmission": 0.0,
      "ior": 1.5,
      "clearcoat": 0.3,
      "clearcoatRoughness": 0.2,
      "subsurfaceWeight": 0.0,
      "subsurfaceRadius": [1.0, 1.0, 1.0],
      "subsurfaceScale": 0.01
    },
    "tissue_myocardium": {
      "baseColor": "#991b1b",
      "metallic": 0.0,
      "roughness": 0.35,
      "transmission": 0.0,
      "ior": 1.33,
      "clearcoat": 0.0,
      "clearcoatRoughness": 0.1,
      "subsurfaceWeight": 0.3,
      "subsurfaceRadius": [1.0, 0.2, 0.1],
      "subsurfaceScale": 0.02
    },
    "tissueMuscle": {
      "baseColor": "#991b1b",
      "metallic": 0.0,
      "roughness": 0.35,
      "transmission": 0.0,
      "ior": 1.33,
      "clearcoat": 0.0,
      "clearcoatRoughness": 0.1,
      "subsurfaceWeight": 0.3,
      "subsurfaceRadius": [1.0, 0.2, 0.1],
      "subsurfaceScale": 0.02
    },
    "tissueOrgan": {
      "baseColor": "#c2410c",
      "metallic": 0.0,
      "roughness": 0.35,
      "transmission": 0.0,
      "ior": 1.33,
      "clearcoat": 0.0,
      "clearcoatRoughness": 0.1,
      "subsurfaceWeight": 0.3,
      "subsurfaceRadius": [1.0, 0.2, 0.1],
      "subsurfaceScale": 0.02
    },
    "tissueNerve": {
      "baseColor": "#fef08a",
      "metallic": 0.0,
      "roughness": 0.35,
      "transmission": 0.0,
      "ior": 1.33,
      "clearcoat": 0.0,
      "clearcoatRoughness": 0.1,
      "subsurfaceWeight": 0.3,
      "subsurfaceRadius": [1.0, 0.2, 0.1],
      "subsurfaceScale": 0.02
    },
    "tissueFat": {
      "baseColor": "#fef9c3",
      "metallic": 0.0,
      "roughness": 0.35,
      "transmission": 0.0,
      "ior": 1.33,
      "clearcoat": 0.0,
      "clearcoatRoughness": 0.1,
      "subsurfaceWeight": 0.3,
      "subsurfaceRadius": [1.0, 0.2, 0.1],
      "subsurfaceScale": 0.02
    },
    "tissueSclera": {
      "baseColor": "#f8fafc",
      "metallic": 0.0,
      "roughness": 0.35,
      "transmission": 0.0,
      "ior": 1.33,
      "clearcoat": 0.0,
      "clearcoatRoughness": 0.1,
      "subsurfaceWeight": 0.3,
      "subsurfaceRadius": [1.0, 0.2, 0.1],
      "subsurfaceScale": 0.02
    },
    "tissueRetina": {
      "baseColor": "#9a3412",
      "metallic": 0.0,
      "roughness": 0.35,
      "transmission": 0.0,
      "ior": 1.33,
      "clearcoat": 0.0,
      "clearcoatRoughness": 0.1,
      "subsurfaceWeight": 0.3,
      "subsurfaceRadius": [1.0, 0.2, 0.1],
      "subsurfaceScale": 0.02
    },
    "tissueCortex": {
      "baseColor": "#fbcfe8",
      "metallic": 0.0,
      "roughness": 0.35,
      "transmission": 0.0,
      "ior": 1.33,
      "clearcoat": 0.0,
      "clearcoatRoughness": 0.1,
      "subsurfaceWeight": 0.3,
      "subsurfaceRadius": [1.0, 0.2, 0.1],
      "subsurfaceScale": 0.02
    },
    "tissueBone": {
      "baseColor": "#f5f5f4",
      "metallic": 0.0,
      "roughness": 0.35,
      "transmission": 0.0,
      "ior": 1.33,
      "clearcoat": 0.0,
      "clearcoatRoughness": 0.1,
      "subsurfaceWeight": 0.3,
      "subsurfaceRadius": [1.0, 0.2, 0.1],
      "subsurfaceScale": 0.02
    },
    "flame_luminescent": {
      "baseColor": "#ffb703",
      "metallic": 0.0,
      "roughness": 0.0,
      "transmission": 0.0,
      "ior": 1.0,
      "clearcoat": 0.0,
      "clearcoatRoughness": 0.1,
      "subsurfaceWeight": 0.0,
      "subsurfaceRadius": [1.0, 1.0, 1.0],
      "subsurfaceScale": 0.01,
      "emissionColor": "#ffb703",
      "emissionStrength": 8.0
    },
    "flame_non_luminous": {
      "baseColor": "#4cc9f0",
      "metallic": 0.0,
      "roughness": 0.0,
      "transmission": 0.0,
      "ior": 1.0,
      "clearcoat": 0.0,
      "clearcoatRoughness": 0.1,
      "subsurfaceWeight": 0.0,
      "subsurfaceRadius": [1.0, 1.0, 1.0],
      "subsurfaceScale": 0.01,
      "emissionColor": "#4cc9f0",
      "emissionStrength": 6.0
    },
    "particle_electron": {
      "baseColor": "#38bdf8",
      "metallic": 0.0,
      "roughness": 0.0,
      "transmission": 0.0,
      "ior": 1.0,
      "clearcoat": 0.0,
      "clearcoatRoughness": 0.1,
      "subsurfaceWeight": 0.0,
      "subsurfaceRadius": [1.0, 1.0, 1.0],
      "subsurfaceScale": 0.01,
      "emissionColor": "#38bdf8",
      "emissionStrength": 3.0
    }
  },
  "camera": {
    "lenses": {
      "ultraWide": 24.0,
      "wide": 35.0,
      "standard": 50.0,
      "portrait": 85.0,
      "macro": 105.0,
      "micro": 135.0
    },
    "shots": {
      "establishExperiment": {
        "lens": 35.0,
        "fovDegrees": 54.4,
        "description": "Wide establishing view of laboratory bench, apparatus, and surroundings"
      },
      "focusOnRibbon": {
        "lens": 50.0,
        "fovDegrees": 39.6,
        "description": "Medium shot focusing on tongs, magnesium ribbon, and Bunsen burner head"
      },
      "zoomIntoMolecularScale": {
        "lens": 85.0,
        "fovDegrees": 23.9,
        "description": "Close-up macro shot transitioning from ribbon surface to atomic lattice"
      },
      "macroInspectProduct": {
        "lens": 105.0,